Provided-by: @wamphlett
Provided-at: 2020-04-27
Source: https://github.com/jonasmalacofilho/liquidctl/issues/78#issuecomment-620247629

Additional info (running 153d4e0dd701 from liquidctl#100):

$ liquidctl initialize
NZXT Kraken X3 Pump (X53, X63 or X73) (experimental)
├── Firmware version                   1.8.0
├── LED 1 accessory 1         HUE+ LED Strip
├── LED 1 accessory 2         HUE+ LED Strip
├── LED 2 accessory 1    Kraken X3 Pump Ring
└── LED 3 accessory 1    Kraken X3 Pump Logo

---

Bus 003 Device 002: ID 1e71:2007 NZXT
Couldn't open device, some information will be missing
Device Descriptor:
  bLength                18
  bDescriptorType         1
  bcdUSB               2.00
  bDeviceClass            0 (Defined at Interface level)
  bDeviceSubClass         0
  bDeviceProtocol         0
  bMaxPacketSize0        64
  idVendor           0x1e71 NZXT
  idProduct          0x2007
  bcdDevice            2.00
  iManufacturer           1
  iProduct                2
  iSerial                 3
  bNumConfigurations      1
  Configuration Descriptor:
    bLength                 9
    bDescriptorType         2
    wTotalLength           41
    bNumInterfaces          1
    bConfigurationValue     1
    iConfiguration          0
    bmAttributes         0xc0
      Self Powered
    MaxPower              100mA
    Interface Descriptor:
      bLength                 9
      bDescriptorType         4
      bInterfaceNumber        0
      bAlternateSetting       0
      bNumEndpoints           2
      bInterfaceClass         3 Human Interface Device
      bInterfaceSubClass      0 No Subclass
      bInterfaceProtocol      0 None
      iInterface              0
	HID Device Descriptor:
	  bLength                 9
	  bDescriptorType        33
	  bcdHID               1.11
	  bCountryCode            0 Not supported
	  bNumDescriptors         1
	  bDescriptorType        34 Report
	  wDescriptorLength     412
	 Report Descriptors:
	   ** UNAVAILABLE **
      Endpoint Descriptor:
	bLength                 7
	bDescriptorType         5
	bEndpointAddress     0x81  EP 1 IN
	bmAttributes            3
	  Transfer Type            Interrupt
	  Synch Type               None
	  Usage Type               Data
	wMaxPacketSize     0x0040  1x 64 bytes
	bInterval               1
      Endpoint Descriptor:
	bLength                 7
	bDescriptorType         5
	bEndpointAddress     0x01  EP 1 OUT
	bmAttributes            3
	  Transfer Type            Interrupt
	  Synch Type               None
	  Usage Type               Data
	wMaxPacketSize     0x0040  1x 64 bytes
	bInterval               1
